{
  "certificate_sha256": "42ce4ed510c5834c3dfcb3dbc0d36435c50f91ce9d28c660363951052ced1117",
  "certificate_version": 1,
  "energy_nj": 850168000,
  "energy_phone_nj": 108568000,
  "energy_server_nj": 741600000,
  "hbm": {
    "mode": {
      "w0": "server",
      "w1": "server"
    },
    "relief_bytes": 0
  },
  "instance_id": "primary_favorable",
  "instance_sha256": "7f2e39293ccbd75be5b84ede73b177fd8a23cb5a7027b34dc576d4db1916b04e",
  "label": "C4_oracle",
  "met": 12,
  "objective_key": [
    0,
    0,
    -12,
    850168000
  ],
  "phone_busy_us": {
    "OP12": 0,
    "OP15": 54284
  },
  "phone_islands": {
    "OP12": [],
    "OP15": [
      "r03",
      "r09"
    ]
  },
  "power_model": {
    "count_phone_idle": false,
    "count_server_idle": false,
    "gpu_active_mw": 300000,
    "gpu_idle_mw": 25000,
    "name": "favorable",
    "note": "mechanism-favorable: GPU 300W ceiling, phone 2W, USB/host 0W, idle uncounted",
    "phone_mw": {
      "OP12": 2000,
      "OP15": 2000
    },
    "usb_host_mw": 0
  },
  "schedule": [
    {
      "deadline": 60000,
      "mid_device": "SERVER",
      "mid_finish": 936,
      "mid_start": 300,
      "mid_tokens": 16,
      "model_id": "m0",
      "outcome": "MET",
      "pre_finish": 50,
      "pre_start": 0,
      "request": "r00",
      "suf_finish": 986,
      "suf_start": 936,
      "weight_set": "w0"
    },
    {
      "deadline": 60000,
      "mid_device": "SERVER",
      "mid_finish": 936,
      "mid_start": 300,
      "mid_tokens": 16,
      "model_id": "m0",
      "outcome": "MET",
      "pre_finish": 100,
      "pre_start": 50,
      "request": "r01",
      "suf_finish": 1036,
      "suf_start": 986,
      "weight_set": "w0"
    },
    {
      "deadline": 60000,
      "mid_device": "SERVER",
      "mid_finish": 936,
      "mid_start": 300,
      "mid_tokens": 16,
      "model_id": "m0",
      "outcome": "MET",
      "pre_finish": 150,
      "pre_start": 100,
      "request": "r02",
      "suf_finish": 1086,
      "suf_start": 1036,
      "weight_set": "w0"
    },
    {
      "deadline": 60000,
      "mid_device": "OP15",
      "mid_finish": 27342,
      "mid_start": 200,
      "mid_tokens": 16,
      "model_id": "m1",
      "outcome": "MET",
      "pre_finish": 200,
      "pre_start": 150,
      "request": "r03",
      "suf_finish": 27392,
      "suf_start": 27342,
      "weight_set": "w1"
    },
    {
      "deadline": 60000,
      "mid_device": "SERVER",
      "mid_finish": 936,
      "mid_start": 300,
      "mid_tokens": 16,
      "model_id": "m0",
      "outcome": "MET",
      "pre_finish": 250,
      "pre_start": 200,
      "request": "r04",
      "suf_finish": 1136,
      "suf_start": 1086,
      "weight_set": "w0"
    },
    {
      "deadline": 60000,
      "mid_device": "SERVER",
      "mid_finish": 936,
      "mid_start": 300,
      "mid_tokens": 16,
      "model_id": "m0",
      "outcome": "MET",
      "pre_finish": 300,
      "pre_start": 250,
      "request": "r05",
      "suf_finish": 1186,
      "suf_start": 1136,
      "weight_set": "w0"
    },
    {
      "deadline": 68000,
      "mid_device": "SERVER",
      "mid_finish": 28328,
      "mid_start": 27692,
      "mid_tokens": 16,
      "model_id": "m0",
      "outcome": "MET",
      "pre_finish": 27442,
      "pre_start": 27392,
      "request": "r06",
      "suf_finish": 28378,
      "suf_start": 28328,
      "weight_set": "w0"
    },
    {
      "deadline": 68000,
      "mid_device": "SERVER",
      "mid_finish": 28328,
      "mid_start": 27692,
      "mid_tokens": 16,
      "model_id": "m0",
      "outcome": "MET",
      "pre_finish": 27492,
      "pre_start": 27442,
      "request": "r07",
      "suf_finish": 28428,
      "suf_start": 28378,
      "weight_set": "w0"
    },
    {
      "deadline": 68000,
      "mid_device": "SERVER",
      "mid_finish": 28328,
      "mid_start": 27692,
      "mid_tokens": 16,
      "model_id": "m0",
      "outcome": "MET",
      "pre_finish": 27542,
      "pre_start": 27492,
      "request": "r08",
      "suf_finish": 28478,
      "suf_start": 28428,
      "weight_set": "w0"
    },
    {
      "deadline": 68000,
      "mid_device": "OP15",
      "mid_finish": 54734,
      "mid_start": 27592,
      "mid_tokens": 16,
      "model_id": "m1",
      "outcome": "MET",
      "pre_finish": 27592,
      "pre_start": 27542,
      "request": "r09",
      "suf_finish": 54784,
      "suf_start": 54734,
      "weight_set": "w1"
    },
    {
      "deadline": 68000,
      "mid_device": "SERVER",
      "mid_finish": 28328,
      "mid_start": 27692,
      "mid_tokens": 16,
      "model_id": "m0",
      "outcome": "MET",
      "pre_finish": 27642,
      "pre_start": 27592,
      "request": "r10",
      "suf_finish": 28528,
      "suf_start": 28478,
      "weight_set": "w0"
    },
    {
      "deadline": 68000,
      "mid_device": "SERVER",
      "mid_finish": 28328,
      "mid_start": 27692,
      "mid_tokens": 16,
      "model_id": "m0",
      "outcome": "MET",
      "pre_finish": 27692,
      "pre_start": 27642,
      "request": "r11",
      "suf_finish": 28578,
      "suf_start": 28528,
      "weight_set": "w0"
    }
  ],
  "server_batches": [
    {
      "batch_id": 0,
      "finish": 936,
      "latency_us": 636,
      "members": [
        "r00",
        "r01",
        "r02",
        "r04",
        "r05"
      ],
      "start": 300,
      "tokens": 80,
      "wave": 0,
      "weight_set": "w0"
    },
    {
      "batch_id": 1,
      "finish": 28328,
      "latency_us": 636,
      "members": [
        "r06",
        "r07",
        "r08",
        "r10",
        "r11"
      ],
      "start": 27692,
      "tokens": 80,
      "wave": 1,
      "weight_set": "w0"
    }
  ],
  "server_busy_us": 2472,
  "tardy": 0,
  "timeout": 0
}
